{
  "schema_version": "1.0",
  "project_id": "project.vibehub",
  "generated_at": "2026-07-11T08:00:00.000Z",
  "model_version": "model.fixture.1",
  "freshness": "fresh",
  "completeness": "unknown",
  "evidence_refs": [
    {
      "evidence_id": "ev.fixture",
      "kind": "test",
      "grade": "hard_observed",
      "label_key": "evidence.fixture.generated",
      "locator": "fixtures/v3/ev.fixture",
      "captured_at": "2026-07-11T08:00:00.000Z"
    }
  ],
  "warnings": [
    {
      "code": "PROJECT_UNINITIALIZED",
      "severity": "info",
      "message_key": "warning.project_uninitialized",
      "evidence_refs": [
        {
          "evidence_id": "ev.fixture",
          "kind": "test",
          "grade": "hard_observed",
          "label_key": "evidence.fixture.generated",
          "locator": "fixtures/v3/ev.fixture",
          "captured_at": "2026-07-11T08:00:00.000Z"
        }
      ]
    },
    {
      "code": "PROJECT_UNINITIALIZED",
      "severity": "info",
      "message_key": "warning.project_uninitialized",
      "evidence_refs": [
        {
          "evidence_id": "ev.fixture",
          "kind": "test",
          "grade": "hard_observed",
          "label_key": "evidence.fixture.generated",
          "locator": "fixtures/v3/ev.fixture",
          "captured_at": "2026-07-11T08:00:00.000Z"
        }
      ]
    },
    {
      "code": "PROJECT_UNINITIALIZED",
      "severity": "info",
      "message_key": "warning.project_uninitialized",
      "evidence_refs": [
        {
          "evidence_id": "ev.fixture",
          "kind": "test",
          "grade": "hard_observed",
          "label_key": "evidence.fixture.generated",
          "locator": "fixtures/v3/ev.fixture",
          "captured_at": "2026-07-11T08:00:00.000Z"
        }
      ]
    },
    {
      "code": "PROJECT_UNINITIALIZED",
      "severity": "info",
      "message_key": "warning.project_uninitialized",
      "evidence_refs": [
        {
          "evidence_id": "ev.fixture",
          "kind": "test",
          "grade": "hard_observed",
          "label_key": "evidence.fixture.generated",
          "locator": "fixtures/v3/ev.fixture",
          "captured_at": "2026-07-11T08:00:00.000Z"
        }
      ]
    },
    {
      "code": "PROJECT_UNINITIALIZED",
      "severity": "info",
      "message_key": "warning.project_uninitialized",
      "evidence_refs": [
        {
          "evidence_id": "ev.fixture",
          "kind": "test",
          "grade": "hard_observed",
          "label_key": "evidence.fixture.generated",
          "locator": "fixtures/v3/ev.fixture",
          "captured_at": "2026-07-11T08:00:00.000Z"
        }
      ]
    },
    {
      "code": "PROJECT_UNINITIALIZED",
      "severity": "info",
      "message_key": "warning.project_uninitialized",
      "evidence_refs": [
        {
          "evidence_id": "ev.fixture",
          "kind": "test",
          "grade": "hard_observed",
          "label_key": "evidence.fixture.generated",
          "locator": "fixtures/v3/ev.fixture",
          "captured_at": "2026-07-11T08:00:00.000Z"
        }
      ]
    }
  ],
  "errors": [],
  "task_id": "task.none",
  "title": "未选择任务",
  "state": "planned",
  "criteria": [],
  "completion": {
    "proposal_event_id": null,
    "proposed_at_version": null,
    "digest": null,
    "valid": false,
    "confirmed": false,
    "confirmed_at_version": null,
    "confirmed_by": null,
    "channel": null
  },
  "lanes": [],
  "events": [],
  "window": {
    "cursor": null,
    "next_cursor": null,
    "limit": 100,
    "returned": 0,
    "total_estimate": 0,
    "truncated": false,
    "truncation_reason": "none",
    "model_version": "model.fixture.1"
  }
}
